,title,location,address,phone,website,price,description,source
146,Mayem Lake View,North Goa,,0832-2362144,www.goa-tourism.com,"d ₹1100, with AC ₹1350-1700, ste ₹2200","Although a bit rundown, Goa Tourism’s Mayem Lake View is almost certainly the nicest of all the GTDC’s hotels and the lakeside location is peaceful. Its rooms are clean enough and good value and there's a restaurant serving breakfast, lunch and dinner.",https://www.lonelyplanet.com/india/goa/inland-bardez-bicholim/hotels/mayem-lake-view/a/poi-sle/1181564/1329278
147,Fernandes,Palolem,,0832-2643743,www.fernandeswoodenhuts.com,cottages ₹2000-3500,"This smart wooden beach hut operation is one of the most eye-catching on the northern beach strip, offering premium sea-facing cottages and cheaper garden cottages behind a very chilled restaurant. A mellow option on an otherwise quite busy bit of beach.",https://www.lonelyplanet.com/india/goa/palolem-and-around/hotels/fernandes/a/poi-sle/1430957/1001559
148,Cola Beach Resort,South Goa,Cola Beach,9822061223,www.colabeach.com,tents/cottages incl breakfast ₹6000/6500,"A short walk north of the lagoon, Cola Beach Resort fronts an even quieter stretch of beach, where Rajasthani safari tents and wooden cottages occupy space among the palms. The tents are spacious and comfortable enough but feel overpriced, even for Cola.",https://www.lonelyplanet.com/india/goa/cola-beach/hotels/cola-beach-resort/a/poi-sle/1507023/1340169
149,Hotel Vilena,North Goa,Feira Baixa Rd,0832-2263115,,d ₹1700-2000,"The once budget Vilena has had a refurb and all rooms are now air-conditioned with bathroom, but it's still good value and the rooms are well kept. There's a restaurant and bar on the 1st floor and a rooftop restaurant called Goan & Grills.",https://www.lonelyplanet.com/india/goa/mapusa/hotels/hotel-vilena/a/poi-sle/1075668/356229
150,Surf Club,Arambol (Harmal),,,www.thesurfclubgoa.com,d ₹1000-1800,"In a quiet space at the end of a lane, on the southern end of Arambol Beach, the Surf Club is one of those cool little hang-outs that offer a bit of everything: simple but clean rooms, a fun bar with live music and surf lessons and board hire.",https://www.lonelyplanet.com/india/goa/arambol-harmal/hotels/surf-club/a/poi-sle/1506355/356226
151,Vilanova,Anjuna,Anjuna Beach Rd,9820232058,,"d ₹900-1000, with AC ₹1200","Big, clean rooms have a fridge, TV, 24-hour hot water and window screens and are set in three Portuguese-style bungalows in a cute little compound. Good vibes and a comfortable family atmosphere, with friendly staff and a good restaurant.",https://www.lonelyplanet.com/india/goa/anjuna/hotels/vilanova/a/poi-sle/1291348/356225
152,Villa Ludovici Tourist Home,North Goa,Fort Aguada Rd,0832-2479684,,d incl breakfast ₹1000,"For over 30 years Ludovici’s has been welcoming travellers into its well-worn, creaky rooms in a fading old Portuguese villa. Four-poster beds on a budget; the four rooms are large and the hosts (and ghosts) are kind and amiable.",https://www.lonelyplanet.com/india/goa/candolim-1329279/hotels/villa-ludovici-tourist-home/a/poi-sle/1075627/1329279
153,Shalom,North Goa,Ozran Beach Rd. Vagator,919881578459,www.shalomguesthousegoa.com,"d ₹900-1500, with AC ₹2000","Arranged around a placid garden not far from the path down to Little Vagator Beach, this established place is run by a friendly family and offers a variety of extremely well-kept rooms and a two-bedroom apartment for long-stayers.",https://www.lonelyplanet.com/india/goa/vagator-chapora/hotels/shalom/a/poi-sle/1150113/1329281
154,Hotel Seagull,Calangute & Baga,Holiday St. Calangute,0832-2179969,www.seagullgoa.com,d ₹3500,"Seagull’s rooms, set in a cheerful blue-and-white house in south Calangute, are light and airy with air-con, and a small pool out back. Downstairs is a streetside bar-restaurant serving Goan, Indian and continental dishes.",https://www.lonelyplanet.com/india/goa/calangute-and-baga/hotels/hotel-seagull/a/poi-sle/1150087/1329280
155,Hotel Tanish,Margao,"Reliance Trade Centre, Valaulikar Rd",0832-2735858,www.hoteltanishgoa.com,"s/d ₹1200/1700, with AC ₹1500/2000","Oddly situated inside a modern mall, this top-floor hotel offers good views of the surrounding countryside, with stylish, well-equipped rooms. Try for an outside-facing room, as some overlook the mall interior.",https://www.lonelyplanet.com/india/goa/margao-madgaon/hotels/hotel-tanish/a/poi-sle/1150130/356235
156,D’Souza Guest House,South Goa,,0832-2770583,,d ₹600,"With just three rooms, this traditional blue-painted house in the back lanes is run by a local Goan family and comes with bundles of homely atmosphere and a lovely garden. It’s often full so book ahead.",https://www.lonelyplanet.com/india/goa/benaulim/hotels/d-souza-guest-house/a/poi-sle/1017981/1315142
157,Casa Paradiso,Panaji,Jose Falcao Rd,0832-3290180,www.casaparadisogoa.com,d/tr with AC ₹2000/2800,"Location is the key to this place, just around the corner from the main church in the heart of the city. Up a small flight of stairs, the simple but clean rooms come with TV, hot water and noon checkout.",https://www.lonelyplanet.com/india/goa/panaji-panjim/hotels/casa-paradiso/a/poi-sle/1150055/356231
158,Rosario’s Inn,South Goa,,0832-2770636,,r with/without AC ₹900/600,"Across a football field flitting with young players and dragonflies, family-run Rosario’s is a large establishment with very clean, simple rooms and a restaurant. Excellent value for long-stayers.",https://www.lonelyplanet.com/india/goa/benaulim/hotels/rosario-s-inn/a/poi-sle/1017983/1315142
159,Summer,Palolem,99/1 Ourem Rd,0832-2643406,www.thehostelcrowd.com/summerhostel,"dm with/without AC ₹550/450, d ₹1500-1900","The latest offering from the Hostel Crowd is minimalist in design but all the facilities are there, with free breakfast, lockers, communal kitchen and lounge, and the popular Bombay Roasters cafe.",https://www.lonelyplanet.com/india/goa/palolem-and-around/hotels/summer/a/poi-sle/1556571/1001559
160,Headquarters,Anjuna,,0832-2274510,,dm with/without AC ₹500/400,"Near the German Bakery, Headquarters ticks all the budget boxes for cleanliness and comfort with upstairs dorms, kitchen and common areas downstairs and a garden with some potential out back.",https://www.lonelyplanet.com/india/goa/anjuna/hotels/headquarters/a/poi-sle/1611595/356225
161,Rainbow Cafe,North Goa,,,,huts ₹1200,"Rainbow has some colourful, decent-value huts behind its convivial beachfront restaurant (mains ₹110 to ₹400) and bar. It’s at the end of Morjim Beach Rd, right on the beach.",https://www.lonelyplanet.com/india/goa/morjim/hotels/rainbow-cafe/a/poi-sle/1506528/1301994
162,Dona Florina,North Goa,"Monteiro’s Rd, Escrivao Vaddo",9923049076,,d ₹2200-3500,Friendly Dona Florina is a no-frills guesthouse in a pleasant tangle of laneways and family-run hotels just back from the beach. Front-facing upper-floor rooms have sea views.,https://www.lonelyplanet.com/india/goa/candolim-1329279/hotels/dona-florina/a/poi-sle/1150071/1329279
163,Melissa Guest House,Calangute & Baga,Baga River Rd. Baga,9822180095,,d ₹1000,"Across the Baga River, Melissa Guest House has just four neat little rooms, all with attached bathrooms and hot-water showers, in a tatty garden. Good value for the location.",https://www.lonelyplanet.com/india/goa/calangute-and-baga/hotels/melissa-guest-house/a/poi-sle/1150084/1329280
164,Furtados,South Goa,,0832-2770396,,d with/without AC ₹1800/1200,"Conveniently positioned at the main entrance to Sernabatim Beach, Furtados has decent, clean and pretty good-value rooms behind its popular beachfront restaurant.",https://www.lonelyplanet.com/india/goa/benaulim/hotels/furtados/a/poi-sle/1505402/1315142
165,Lazy Lama,Anjuna,,9717000955,,dm ₹300-500,"A laid-back hostel down a quiet lane in Anjuna village, Lazy Lama offers six- and 10-bed dorms in a partly converted Portuguese house. Attracts a chilled crowd.",https://www.lonelyplanet.com/india/goa/anjuna/hotels/lazy-lama/a/poi-sle/1613275/356225
166,Om Ganesh,Arambol (Harmal),,9404313206,,r ₹600-800,"Halfway along the cliff, Om Ganesh has been around for a while and has solid rooms in a building on the hillside, and seasonal huts-with-a-view on the rooftop.",https://www.lonelyplanet.com/india/goa/arambol-harmal/hotels/om-ganesh/a/poi-sle/1116727/356226
167,Ruffles Beach Resort,North Goa,Fort Aguada Rd,9850752662,www.rufflesgoa.com,d ₹2700-3500,A pleasant courtyard pool and well-equipped rooms make this a reliably good midrange choice. There’s a good little restaurant and bar facing the road.,https://www.lonelyplanet.com/india/goa/candolim-1329279/hotels/ruffles-beach-resort/a/poi-sle/1150073/1329279
168,Baba Place,North Goa,Chapora Fort Rd. Chapora,9822156511,,d ₹2500,"Baba Place, in the shadow of Chapora Fort, continues to improve with immaculate, decent-sized rooms with verandah, a small pool and a bar-restaurant.",https://www.lonelyplanet.com/india/goa/vagator-chapora/hotels/baba-place/a/poi-sle/1506421/1329281
169,Ludu Guest House,Arambol (Harmal),,9404434332,,r ₹500-1000,"Better than some similarly priced Arambol options, Ludu offers simply decorated, clean and bright cliffside rooms with attached cold-water showers.",https://www.lonelyplanet.com/india/goa/arambol-harmal/hotels/ludu-guest-house/a/poi-sle/1150124/356226
170,Matashree Beach Huts,South Goa,,9823609183,,huts ₹1500,"The budget offering on Talpona Beach, Matashree has 10 basic lime-green huts on the beach, with bathroom and fan. A bargain for the location.",https://www.lonelyplanet.com/india/goa/galgibag-talpona/hotels/matashree-beach-huts/a/poi-sle/1613846/1329294
171,Shree Sai Cottages,Arambol (Harmal),,9420767358,,hut ₹800,"At the north end of the cliffs, Shree Sai has simple, cute, sea-facing huts overlooking Kalacha Beach, alongside a good restaurant.",https://www.lonelyplanet.com/india/goa/arambol-harmal/hotels/shree-sai-cottages/a/poi-sle/1150123/356226
172,Garden Villa,North Goa,Vagator Beach Rd. Vagator,9822104780,,d ₹2500-3200,Just four clean rooms and two spacious bungalows in the garden behind an old Portuguese house; has a popular restaurant attached.,https://www.lonelyplanet.com/india/goa/vagator-chapora/hotels/garden-villa/a/poi-sle/1291401/1329281
173,Nest,Palolem,,9604416142,www.thenestpalolem.com,"d ₹1500-2500, with AC ₹5000","This very nifty village of seafront beach huts and restaurant is good value. The best huts have sea views, TV and air-con.",https://www.lonelyplanet.com/india/goa/palolem-and-around/hotels/nest/a/poi-sle/1558643/1001559
174,Casa Diya,South Goa,Cola Beach,9158053843,,huts ₹1500,This is the budget offering on Cola Beach with just a few hillside huts and a basic restaurant south of the lagoon.,https://www.lonelyplanet.com/india/goa/cola-beach/hotels/casa-diya/a/poi-sle/1613986/1340169
175,Pitruchaya Cottages,Arambol (Harmal),,9404454596,,r ₹700-800,"The sea-facing timber cottages here are among the best on the cliffs, with attached bathrooms, fans and verandahs.",https://www.lonelyplanet.com/india/goa/arambol-harmal/hotels/pitruchaya-cottages/a/poi-sle/1430610/356226
176,Hotel Sona,Panaji,Ourem Rd,0832-2222226,www.hotelsonagoa.com,d ₹3450-4300,"With a nice location opposite Ourem Creek, Sona is a sound but pretty boring choice in a good area, and probably a fraction overpriced. Not all of the 30 clinical-but-clean air-con rooms of this four-storey building face the river, so check out a few.",https://www.lonelyplanet.com/india/goa/panaji-panjim/hotels/hotel-sona/a/poi-sle/1181933/356231
177,Hotel Ria Residency,Panaji,Ourem Rd,0832-2220002,,d ₹1500-2000,"Contrasting starkly with its heritage neighbours, this characterless blue-and-white corner place doesn’t look very appealing but at this price it’s not bad value for the location with reasonably comfortable air-con rooms.",https://www.lonelyplanet.com/india/goa/panaji-panjim/hotels/hotel-ria-residency/a/poi-sle/1181932/356231
178,Margao Residency,Margao,Luis Miranda Rd,0832-2715528,,"d ₹1410, with AC ₹2200, ste ₹2800","The omnipresent GTDC’s outfit in town is an acceptable but dull choice, with cleanish rooms and a good location opposite the Municipal Library. Persistent taxi touts out front can get tiresome.",https://www.lonelyplanet.com/india/goa/margao-madgaon/hotels/margao-residency/a/poi-sle/1040990/356235
179,Coco Banana,Calangute & Baga,,9960803790,,d with/without AC ₹1500/1200,"Among the palms south of the main entrance to Calangute Beach, low-key Coco Banana has been providing a retreat for travellers for many years. Rooms are spacious and spotless and the vibe mellow.",https://www.lonelyplanet.com/india/goa/calangute-and-baga/hotels/coco-banana/a/poi-sle/1150083/1329280
180,Mapusa Residency,North Goa,Calangute-Mapusa Rd,0832-2262694,,"s/d/tr ₹1250/1600/2000, d with AC ₹2200","Rooms are in the bland-but-functional mould you’d expect from GTDC accommodation, but the borderline budget-midrange price tag is reasonable value for the location across from the bus stand.",https://www.lonelyplanet.com/india/goa/mapusa/hotels/mapusa-residency/a/poi-sle/1075667/356229
