,title,location,address,phone,website,price,description,source
91,Rainbow Lining,Palolem,76 Ourem Rd,8390248102,,"dm ₹450-600, d ₹2500","This refurbished house is a good deal for backpackers with four- to 10-bed air-con dorms (bunks are curtained off) and a few private rooms. Friendly owners, rooftop yoga and breakfast available. At the time of writing, a new restaurant-bar MOG (Mad Over Goa) was about to open.",https://www.lonelyplanet.com/india/goa/palolem-and-around/hotels/rainbow-lining/a/poi-sle/1613170/1001559
92,Om Shiv Hotel,Margao,Cine Lata Rd,0832-2710294,www.omshivhotel.com,s/d ₹2400/2700,"In a lemon-yellow multistorey building tucked away behind the Bank of India, Om Shiv does a decent line in fading ‘executive’ rooms, all of which have air-con and balcony. There’s a gym and the 7th-floor Rockon Pub. Attractive online rates can make it worthwhile.",https://www.lonelyplanet.com/india/goa/margao-madgaon/hotels/om-shiv-hotel/a/poi-sle/1291528/356235
93,Nanutel Margao,Margao,Padre Miranda Rd,0832-6722222,www.nanuhotels.in,s/d incl breakfast ₹5300/5900,"Margao’s best business-class hotel by some margin, Nanutel is modern and slick with a lovely pool, good restaurant, bar and coffee shop, and clean air-con rooms. The location, between the Municipal Gardens and Largo de Igreja district, is convenient for everything.",https://www.lonelyplanet.com/india/goa/margao-madgaon/hotels/nanutel-margao/a/poi-sle/1507010/356235
94,Lotus Sutra,Arambol (Harmal),,9146096940,www.lotussutragoa.com,d & cottages ₹4000-5500,The fanciest place on Arambol's beachfront has a series of bright rooms in a quirky two-storey building and cute individual timber cottages facing a garden-lawn setting or towards the seafront. The Zen Oasis restaurant-bar is a popular spot and features live music.,https://www.lonelyplanet.com/india/goa/arambol-harmal/hotels/lotus-sutra/a/poi-sle/1556496/356226
95,Hotel Fidalgo,Panaji,18th June Rd,0832-6658000,www.fidalgogroup.com,"d ₹7000-8500, ste from ₹14,000","The city centre’s long-running business hotel is slightly stuffy and old-fashioned but Fidalgo works with snappy service and a good range of cuisines courtesy of its ‘food enclave’, including a good vegetarian Indian restaurant. Cheaper deals online.",https://www.lonelyplanet.com/india/goa/panaji-panjim/hotels/hotel-fidalgo/a/poi-sle/1048875/356231
96,Banyan Soul,Anjuna,,9820707283,www.thebanyansoul.com,d ₹3000,"A slinky 12-room option, tucked down the lane off Market Rd, and lovingly conceived and run by Sumit, a young Mumbai expat. Rooms are chic and well equipped with AC and TV, and there’s a lovely library and shady seating area beneath a banyan tree.",https://www.lonelyplanet.com/india/goa/anjuna/hotels/banyan-soul/a/poi-sle/1150103/356225
97,Art Resort,Palolem,Ourem Rd,9665982344,www.art-resort-goa.com,huts ₹6200-9500,"The nicely designed upmarket beachfront cottages around an excellent restaurant have a Bedouin camp feel with screened sit-outs, double storeys and modern artworks sprinkled throughout. The resort hosts art exhibitions and has regular live music.",https://www.lonelyplanet.com/india/goa/palolem-and-around/hotels/art-resort/a/poi-sle/1506071/1001559
98,Lemon Tree Amarante Beach Resort,North Goa,Fort Aguada Rd,0832-3988188,www.lemontreehotels.com,r from ₹8400,"This boutiquey, luxe place on the main strip conjures up a strange mixture of Thai-spa style and medieval motifs. It works, though, with swish rooms equipped with wi-fi and DVD players, a luxurious spa and a roomy courtyard pool with swim-up bar.",https://www.lonelyplanet.com/india/goa/candolim-1329279/hotels/lemon-tree-amarante-beach-resort/a/poi-sle/1150075/1329279
99,Florinda’s,Anjuna,,9890216520,,"s/d ₹800/1000, with AC ₹1500","One of the better budget places near the beach and a bit hidden next to Janet & John's, Florinda’s has clean rooms, with 24-hour hot water, window screens and mosquito nets, set around a pretty garden. The few air-con rooms fill up fast.",https://www.lonelyplanet.com/india/goa/anjuna/hotels/florinda-s/a/poi-sle/1291356/356225
100,Namaste Jungle Garden,North Goa,138/3 Bairo Alto,9850466105,,cottage & apt incl breakfast ₹3500,There's a real feeling of communing with nature in these slick and spacious timber cottages set back in a jungly Assagao garden. It also has two apartment-style rooms with kitchen in the main building and massage and yoga available.,https://www.lonelyplanet.com/india/goa/assagao-1341403/hotels/namaste-jungle-garden/a/poi-sle/1611583/1341403
101,Casa de Olga,North Goa,Harbour Rd. Chapora,9822157145,,"r ₹800-1350, without bathroom from ₹500","This welcoming family-run homestay, set around a nice garden on the way to Chapora harbour, offers spotless rooms of varying sizes in a three-storey building. The best are the top-floor rooms with swanky bathrooms, TV and balcony.",https://www.lonelyplanet.com/india/goa/vagator-chapora/hotels/casa-de-olga/a/poi-sle/1075692/1329281
102,Goan Café & Resort,North Goa,,0832-2244394,www.goancafe.com,"apt & cottages from ₹1800, with AC ₹2200, tree houses ₹2200, without bathroom ₹1200","Fronting Morjim Beach, this excellent family-run resort has a fine array of beachfront stilted ‘tree house’ huts and more solid rooms (some with AC) at the back. The beachfront restaurant is good and breakfast is included.",https://www.lonelyplanet.com/india/goa/morjim/hotels/goan-cafe-resort/a/poi-sle/1291457/1301994
103,Micky's,South Goa,,9850484884,www.mickyhuts.com,d ₹1500-2000,Micky's is an old-timer at the north end of Patnem Beach with a range of simple budget huts and rooms. It’s run by a friendly family and open for most of the year. There's a cruisey beachfront bar and cafe among the palms.,https://www.lonelyplanet.com/india/goa/patnem/hotels/micky-s/a/poi-sle/1150156/1302135
104,Casa Baga,Calangute & Baga,Tito's Lane 2. Baga,0832-2253204,www.casaboutiquehotels.com,"d ₹8400-11,200","The 24 luxury Balinese-style rooms, some with huge four-poster beds, make for a classy and tranquil stay in the midst of Baga’s action, with all the little stylish touches the Casa boutique team is so adept at providing.",https://www.lonelyplanet.com/india/goa/calangute-and-baga/hotels/casa-baga/a/poi-sle/1024790/1329280
105,A Pousada Guest House,Panaji,Luis de Menezes Rd,0832-2422618,,"s/d from ₹950/1200, d with AC ₹1800","The five rooms in this bright-yellow place are simple but clean and come with comfy spring-mattress beds and TV. Owner Sabrina is friendly and no-nonsense, and it’s one of the better budget guesthouses in Fountainhas.",https://www.lonelyplanet.com/india/goa/panaji-panjim/hotels/a-pousada-guest-house/a/poi-sle/1290441/356231
106,Sevas,Palolem,,9422065437,www.sevaspalolemgoa.com,d huts ₹800-1500,"Hidden in the jungle on the Colomb Bay side of Palolem, Sevas has some of the more basic palm-thatch huts around, reflected in the price. But it's a very peaceful place set in a lovely shaded garden area.",https://www.lonelyplanet.com/india/goa/palolem-and-around/hotels/sevas/a/poi-sle/1181947/1001559
107,Cuba Agonda,South Goa,Agonda Beach,0832-2645775,www.cubagoa.com,"d ₹6200-10,000","These blue-and-white sea-facing cottages look a bit like fancy English bathing boxes but they’re well-appointed inside with air-con, TV and comfy beds, and verandas with steps straight to the beach.",https://www.lonelyplanet.com/india/goa/agonda/hotels/cuba-agonda/a/poi-sle/1507028/1302133
108,Abrigo de Botelho,Panaji,Rue de Natal,9527778884,www.hadbgoa.com,r incl breakfast ₹3250-5250,"At the end of a quiet lane in the Old Quarter, the six rooms in this lovely sky-blue heritage house are spacious, neatly furnished and enhanced with antiques, but still offer cable TV, AC and wi-fi.",https://www.lonelyplanet.com/india/goa/panaji-panjim/hotels/abrigo-de-botelho/a/poi-sle/1505262/356231
109,Caravela Homestay,Panaji,27 31st January Rd,0832-2237448,,d/ste incl breakfast from ₹2500/4000,"In a beautiful Sao Tomé heritage building, Caravela has 10 minimalist but comfortable rooms with extra touches such as minibar and toiletries. Across the lane is the cafe where breakfast is served.",https://www.lonelyplanet.com/india/goa/panaji-panjim/hotels/caravela-homestay/a/poi-sle/1558646/356231
110,Casa Britona,North Goa,,0832-2416737,www.casaboutiquehotels.com,"d from ₹10,300","Casa Britona is a gorgeous 300-year-old converted customs warehouse on the water, with luxurious antique-filled rooms, fine outdoor dining beneath the stars and a lovely riverside swimming pool.",https://www.lonelyplanet.com/india/goa/inland-bardez-bicholim/hotels/casa-britona/a/poi-sle/1181565/1329278
111,D'Hibiscus,North Goa,83 Sinquerim,0832-2479842,www.dehibiscus.com,"d ₹4200, penthouse ₹6600","Huge modern rooms with balconies are the draw at this Portuguese home off Sinquerim Beach. The top-floor penthouse rooms, with spa bath, big-screen TV and balcony sunbeds, are worth a splurge.",https://www.lonelyplanet.com/india/goa/candolim-1329279/hotels/d-hibiscus/a/poi-sle/1556464/1329279
112,Bougainvillea Patnem,South Goa,,9822189913,www.bougainvilleapatnem.com,huts ₹2000-3500,Simple but clean and good value rooms behind the restaurant as well as the few premium sea-facing huts at the front. Yoga retreats and drop-in classes and ayurvedic treatments available.,https://www.lonelyplanet.com/india/goa/patnem/hotels/bougainvillea-patnem/a/poi-sle/1554708/1302135
113,Pappi Chulo,North Goa,Ozran Beach Rd. Vagator,9075135343,,"dm with/without AC ₹550/450, d ₹2000","Unashamedly Vagator's party hostel, Pappi's has a bar in the garden, movie nights and an international vibe of travellers just hanging out. Themed dorms have lockers and bunk beds.",https://www.lonelyplanet.com/india/goa/vagator-chapora/hotels/pappi-chulo/a/poi-sle/1558750/1329281
114,Baba Guesthouse & Villa,North Goa,Main St. Chapora,9822161142,,d with/without AC ₹1000/700,"With its laid-back Chapora location, Baba is often full with long-stayers but you might be lucky as a walk-in. The 14 rooms are clean and simple but serviceable.",https://www.lonelyplanet.com/india/goa/vagator-chapora/hotels/baba-guesthouse-villa/a/poi-sle/1075695/1329281
115,Abba's Gloryland,South Goa,Agonda Beach Rd,0832-2647822,www.abbasgloryland.com,"huts ₹1200, r with AC ₹1900","Back from the beach, Abba's is a decent budget choice with timber cottages at the side and air-con rooms in a separate building, all in a pleasant garden.",https://www.lonelyplanet.com/india/goa/agonda/hotels/abba-s-gloryland/a/poi-sle/1613679/1302133
116,Palm Trees Ayurvedic Heritage,South Goa,,9673178731,www.thepalmtreesayurvedagoa.com,huts ₹5300-6800,This ayurvedic resort has an exquisite riverside location in a thick palm grove at the southern end of Patnem village (access from Patnem–Rajbag road).,https://www.lonelyplanet.com/india/goa/patnem/hotels/palm-trees-ayurvedic-heritage/a/poi-sle/1613966/1302135
117,Fatima Guesthouse,South Goa,,0832-2647477,www.fatimasguesthouse.com,"d ₹1000-1500, with AC ₹1500-2500","An ever-popular budget guesthouse set back from the beach, with clean rooms, a good restaurant and obliging staff. Rooftop yoga classes in season.",https://www.lonelyplanet.com/india/goa/agonda/hotels/fatima-guesthouse/a/poi-sle/1181941/1302133
118,Casa de Goa,Calangute & Baga,"Dr Afonso Rd, Tivai Vaddo",0832-6717777,www.casadegoa.com,d/ste/villa incl breakfast from ₹5200/7000/8900,"The beautiful Casa de Goa is popular with Indian families and books up months in advance for weekends and high season. Portuguese-style yellow ochre buildings orbit a pretty pool courtyard. Decor is bright and fresh, and the big, clean rooms have safes, flat-screen TVs and new fridges, with other high-end and thoughtful touches.
It’s a good deal from April to October when rates are less than half.",https://www.lonelyplanet.com/india/goa/calangute-and-baga/hotels/casa-de-goa/a/poi-sle/1291194/1329280
119,Hotel Golden Eye,Calangute & Baga,Holiday St. Calangute,0832-2277308,www.hotelgoldeneye.com,d ₹2800-4500,"This popular beachfront hotel at the end of ‘Holiday St’ has a fine range of rooms and apartments, from cheaper but tidy ones at the back to the boutique sea-facing rooms with modern decor, AC and cable TV. Unlike some midrangers, it’s welcoming to independent walk-in travellers, though you’ll need to book ahead in season.
The Flying Dolphin beach restaurant is out front.",https://www.lonelyplanet.com/india/goa/calangute-and-baga/hotels/hotel-golden-eye/a/poi-sle/1506646/1329280
120,Kamaxi Beach Resort,South Goa,,9141615846,www.kamaxibeachresort.com,"cottages ₹2000, d ₹1500, without bathroom ₹1000, with AC ₹3500","Kamaxi Beach Resort, the sole place to stay in Polem, has some pretty earthy rooms but you’re paying for the seclusion, and the friendly brothers work hard at keeping the place clean and very low-key. Basic wooden huts are at the southern end of the beach and simple rooms in a pair of buildings at the northern beach entrance. A basic restaurant serves fresh seafood and cold drinks.",https://www.lonelyplanet.com/india/goa/polem/hotels/kamaxi-beach-resort/a/poi-sle/1181971/1329295
121,Ospey’s Shelter,Calangute & Baga,,7798100981,,d ₹1000,"Tucked away between the beach and St Anthony’s Chapel, in a quiet, lush little area full of palms and sandy paths, Ospey’s is a traveller favourite and only a two-minute walk from the beach. Spotless upstairs rooms have fridges and balconies and the whole place has a cosy family feel. Take the road directly west of the chapel – but it’s tough to find, so call ahead.",https://www.lonelyplanet.com/india/goa/calangute-and-baga/hotels/ospey-s-shelter/a/poi-sle/1291199/1329280
122,Palolem Beach Resort,Palolem,,9764442775,www.cubagoa.com,"r with/without AC ₹4300/3400, cottages ₹5300-6000","The location is handy, on the beachfront at the main road entrance to the beach, but that only contributes to the lack of soul here and the rooms and huts are overpriced and devoid of character. However, it is a good value option in the fringe seasons when it's one of the only beachfront places open. There's a middling restaurant.",https://www.lonelyplanet.com/india/goa/palolem-and-around/hotels/palolem-beach-resort/a/poi-sle/1075730/1001559
123,Byke Old Anchor,South Goa,Cavelossim Rd. Cavelossim,0832-6627172,www.thebyke.com,r ₹2700-5000,"One of Cavelossim's original resorts, the ageing Old Anchor is quaint and hard to miss – the main building is shaped like a ship. But it remains good value compared with the fancy resorts around it. Rooms are plain but comfortable, with modern amenities, and the pool, bar and veg restaurant all have an appealing holiday quality.",https://www.lonelyplanet.com/india/goa/cavelossim-mobor/hotels/byke-old-anchor/a/poi-sle/1613173/1315143
124,Chilli’s,Arambol (Harmal),Glastonbury St,9921882424,,"d ₹700, apt with AC ₹1200","Near the beach entrance on Glastonbury St, this friendly canary-yellow place is one of Arambol’s better nonbeachfront bargains. There are 10 decent, no-frills rooms, all with attached bathroom, fan and a hot-water shower. The top-floor apartment with AC and TV is good value. Motorbikes and scooters available for hire.",https://www.lonelyplanet.com/india/goa/arambol-harmal/hotels/chilli-s/a/poi-sle/1150122/356226
125,Palacete Rodrigues,Anjuna,Mazal Vaddo,0832-2273358,,d ₹2800-3500,"This lovely family-run mansion, filled with antiques and ornate furniture, is as quirky as you could hope for in Anjuna – perhaps too over-the-top for some. Some of the 14 rooms and suites are themed and decorated along ethnic cultural lines: French, Chinese, Japanese and Goan. Outside is a neat garden and pool area.",https://www.lonelyplanet.com/india/goa/anjuna/hotels/palacete-rodrigues/a/poi-sle/1024800/356225
126,Cotiago Cottages,Palolem,,,,₹800-1500,"If you’re serious about spotting wildlife at Cotigao Wildlife Sanctuary, it might be worth staying a night in one of the forest department cottages, right behind the reception at the park entrance. They’re no frills but clean, and meals can be arranged. From here you can make a start before the park even opens.",https://www.lonelyplanet.com/india/goa/palolem-and-around/hotels/cotiago-cottages/a/poi-sle/1505820/1001559
127,Cavala Seaside Resort,Calangute & Baga,Calungute-Baga Rd. Baga,0832-2276090,www.cavala.com,"s/d incl breakfast from ₹2300/3900, d & ste with AC ₹5400-8000","Idiosyncratic, ivy-clad Cavala has been harbouring Baga-bound travellers for over 25 years and is often full, especially the cheaper rooms. Perhaps as a result, the service is indifferent, but there’s a big range of rooms, a pool (across the road at Banana Republic) and a bar-restaurant with frequent live music.",https://www.lonelyplanet.com/india/goa/calangute-and-baga/hotels/cavala-seaside-resort/a/poi-sle/1024764/1329280
128,Palolem Guest House,Palolem,Ourem Rd,0832-2644879,www.palolemguesthouse.com,"d from ₹2550, with AC ₹3000-5700","Set back from the beach on Ourem Rd, Palolem Guest House has been around a long time and will suit travellers not looking for the beach-hut experience. A range of plain but comfortable rooms, most with air-con, are arranged around a nice leafy garden. It’s a short walk to the beach and several good restaurants.",https://www.lonelyplanet.com/india/goa/palolem-and-around/hotels/palolem-guest-house/a/poi-sle/1075729/1001559
129,Alcove Resort,North Goa,,0832-2274491,www.alcovegoa.com,d ₹5400-8500,"The location overlooking Little Vagator Beach is hard to beat at this price. Attractively furnished rooms, slightly larger cottages, and four suites surrounding a decent central pool, restaurant and bar, make this a good place for those who want a touch of affordable luxury near the beach. Add ₹500 for air-con.",https://www.lonelyplanet.com/india/goa/vagator-chapora/hotels/alcove-resort/a/poi-sle/1075682/1329281
130,Beachside by Bombay Backpackers,North Goa,Asvem Beach Rd,9781040244,,"dm ₹400-450, d ₹1650","Down a lane off the main road opposite the beach, this backpackers in a converted old house makes a decent budget stay with four- to six-bed dorms with individual fans and lockers. There's a distinct lack of traveller vibe compared with some of north Goa's hostels but the location and price are good.",https://www.lonelyplanet.com/india/goa/aswem/hotels/beachside-by-bombay-backpackers/a/poi-sle/1611590/1329282
131,Mayfair Hotel,Panaji,Dr Dada Vaidya Rd,0832-2223317,,s/d from ₹3100/3500,"The oyster-shell windows and mosaic tiling in the lobby of this popular corner hotel are promising and the refurbished rooms are mostly in good shape. Ask to see a few as there are new and old wings with rooms of varying quality, some overlooking a potentially nice back garden. Noon checkout.",https://www.lonelyplanet.com/india/goa/panaji-panjim/hotels/mayfair-hotel/a/poi-sle/1048873/356231
132,Divine Guest House,Calangute & Baga,Baga River Rd. Baga,9370273464,www.indivinehome.com,"d ₹1200, with AC ₹1600, apt ₹3000","Long-running Divine still sits prettily behind a plant-covered wall on the relatively quiet headland north of the Baga River. The ‘Praise the Lord’ gatepost offers a little gentle proselytising from the friendly family, while the rooms are homey and bright with the odd individual touches.",https://www.lonelyplanet.com/india/goa/calangute-and-baga/hotels/divine-guest-house/a/poi-sle/1150085/1329280
133,Hotel Mandovi,Panaji,Dayanand Bandodkar Marg,0832-2426270,www.hotelmandovigoa.com,"standard s/d ₹4200/4800, executive s/d ₹4800/5500, ste ₹9000","A Panaji institution for more than 50 years, the Mandovi offers dated rooms, many looking out onto the wide Mandovi River. For ambience, style and facilities, it’s outdone by other top-end hotels in town, but it's well-priced in the midrange bracket. There are a couple of good restaurants.",https://www.lonelyplanet.com/india/goa/panaji-panjim/hotels/hotel-mandovi/a/poi-sle/449827/356231
134,Oceanic Hotel,Palolem,,0832-2643059,www.oceanicgoa.com,d ₹4200-7200,"This neat white building, set a fair distance from the beach on the road between Palolem and Patnem, is a popular six-room boutique hotel, made particularly appealing by its swimming pool and patio restaurant, Baa's Kitchen. The standard rooms are compact, the upstairs deluxe ones bigger.",https://www.lonelyplanet.com/india/goa/palolem-and-around/hotels/oceanic-hotel/a/poi-sle/1075727/1001559
135,Casa Nova,Panaji,Gomes Pereira Rd,9423889181,www.casa-nova-homestay.goa-india-hotels-resorts.com,apt ₹7800,"In a gorgeous Portuguese-style house (c 1831) in Fontainhas, Casa Nova comprises just one stylish, exceptionally comfy double-bed apartment, accessed via a little alley and complete with arched windows, wood-beam ceilings, and mod-cons including a kitchenette and wi-fi. Book well ahead.",https://www.lonelyplanet.com/india/goa/panaji-panjim/hotels/casa-nova/a/poi-sle/1290439/356231
136,O Pescador,Panaji & Central Goa,,0832-2453863,www.opescador.com,"d ₹5600-7200, ste ₹7850","Part of the Indy resort chain, O Pescador’s waterfront site has been utilised to create well-decorated mock-Portuguese villas with a nice view of the ‘private’ beach. It’s a firm favourite among the UK package-holiday crowd, with comfy rooms and a nice little pool deck.",https://www.lonelyplanet.com/india/goa/dona-paula/hotels/o-pescador/a/poi-sle/1181956/1317439
137,Cidade de Goa,Panaji & Central Goa,,0832-2454545,www.cidadedegoa.com,"d ₹16,700-20,000","Indulgence is the order of the day at this swanky village-style place, designed by renowned local architect Charles Correa, located 1km down the coast from Dona Paula at Vanguinim Beach. All the usual opulence is on offer, including pool, spa and casino, and eight restaurants.",https://www.lonelyplanet.com/india/goa/dona-paula/hotels/cidade-de-goa/a/poi-sle/1116853/1317439
138,Julie Jolly,North Goa,Ozran Beach Rd. Vagator,0832-2273620,www.hoteljollygoa.com,"d from ₹1750, with AC ₹1950-2400","Rooms are neat and spacious, like little Spanish villas surrounding a small pool. It’s back from the beach action but has its own resort-style atmosphere. The owners also run two cheaper guesthouses in Vagator worth checking out – Jolly Jolly Lester and Jolly Jolly Roma.",https://www.lonelyplanet.com/india/goa/vagator-chapora/hotels/julie-jolly/a/poi-sle/1181698/1329281
139,Wellness Inn,North Goa,,9075006776,www.wellnessinn.in,d/f from ₹3200/4800,"This 13-room guesthouse will suit yoga practitioners with daily drop-in classes, yoga training on the rooftop terrace and a health-conscious veg restaurant. Rooms are spacious, airy and all have air-con. It's often busy with travellers on yoga retreats so book ahead.",https://www.lonelyplanet.com/india/goa/aswem/hotels/wellness-inn/a/poi-sle/1552766/1329282
140,Marquito's Guesthouse,Panaji,Dr Cunha Consalves Rd,9325122039,,s/d/tr incl breakfast ₹3000/3250/4100,"This attractive olive-green Portuguese house down a lane off 31st January Rd in Sao Tomé is equipped with compact, clean and plain-white rooms, but there's certainly a cosiness here. The rooms are all air-conditioned with TV and hardwood floors, some with balcony.",https://www.lonelyplanet.com/india/goa/panaji-panjim/hotels/marquito-s-guesthouse/a/poi-sle/1612692/356231
141,Aerostel,Calangute & Baga,2/201 Naikawaddo. Calangute,9833345744,,dm ₹500-750,This basic backpackers' hostel is a welcome budget addition to Calangute in a super-central location behind the main market (it's actually down a quiet lane opposite KFC). The six-/eight-/10-bed dorms are air-conditioned with en suite and there's a basic kitchen.,https://www.lonelyplanet.com/india/goa/calangute-and-baga/hotels/aerostel/a/poi-sle/1610918/1329280
142,Hotel Satyaheera,North Goa,Anjuna-Mapusa Rd,0832-2262949,,d with/without AC from ₹2500/2200,"Next to the little Maruti temple in the town centre, this is Mapusa’s best central midrange hotel, which isn't saying much. Rooms are comfortable enough and Ruchira, the roof-garden restaurant, is a decent place to eat.",https://www.lonelyplanet.com/india/goa/mapusa/hotels/hotel-satyaheera/a/poi-sle/1075666/356229
143,Sunbeam,North Goa,Anjuna-Mapusa Rd,,www.justjivi.com/goa.html,"ste from ₹10,000","This pair of creative suites is one of North Goa’s most idiosyncratic properties. Owned and overseen by Jivi Sethi, a well-known and flamboyant Indian stylist, it’s all heirlooms, high theatrics, and lots of understated luxury – as well as fabulous food.",https://www.lonelyplanet.com/india/goa/assagao-1341403/hotels/sunbeam/a/poi-sle/1431359/1341403
144,Villa River Cat,North Goa,438/1 Junas Waddo,0832-2247928,www.villarivercat.com,"d ₹3800-4800, without bathroom ₹3100","This fabulously quirky circular guesthouse – filled with art, light, antiques, and an owner with a decidedly creative inclination – is popular with arty types, potential screenwriters and return guests. Animal lovers will enjoy the resident cats and dogs.",https://www.lonelyplanet.com/india/goa/mandrem/hotels/villa-river-cat/a/poi-sle/1150121/1301996
145,Hotel Sun Inn,Panaji & Central Goa,,0832-2318180,www.hotelsuninn.com,s/d incl breakfast from ₹2900/4000,"Sun Inn is a comfortable multistorey business hotel a few kilometres from central Ponda on the highway to Panaji, making it handy for temple visits. Expect clean, orderly rooms with TV and air-con. The upper-floor rooms have good views over the countryside.",https://www.lonelyplanet.com/india/goa/ponda-region/hotels/hotel-sun-inn/a/poi-sle/1506050/1317440
