,title,location,address,phone,website,price,description,source
43,Dreamcatcher,Palolem,,9646872700,www.dreamcatcher.in,d huts ₹2500-6800,"One of the largest hut resorts in Palolem, Dreamcatcher’s 60-plus sturdy huts are nevertheless secluded, set in a coconut grove just back from the far northern end of the beach. One of the highlights here is the riverside restaurant and cocktail bar, plus the wide range of holistic treatments, massage and yoga on offer, with drop-in yoga and reiki courses available.
Access it from the back road running parallel to the beach.",https://www.lonelyplanet.com/india/goa/palolem-and-around/hotels/dreamcatcher/a/poi-sle/1181948/1001559
44,Pousada Tauma,Calangute & Baga,,0832-2279061,www.pousada-tauma.com,ste incl meals US$360-530,"If you’re looking for luxury with your ayurvedic regime, this gorgeous little boutique hotel in busy Calangute is appropriately shielded from the outside world. Spacious, nicely furnished suites are set around a super fountain-fed pool. Rates include all meals at the romantic little open-air Copper Bowl restaurant, though ayurvedic treatments in the private centre are extra.
There’s also a shuttle to its beach restaurant.",https://www.lonelyplanet.com/india/goa/calangute-and-baga/hotels/pousada-tauma/a/poi-sle/1024791/1329280
45,La Maison,Panaji,31st January Rd,0832-2235555,www.lamaisongoa.com,r incl breakfast ₹4700-5300,"One of the growing range of boutique heritage hotels in Fontainhas, La Maison is historic on the outside but thoroughly modern and swanky within, with a Euro-meets-Orient vibe. The eight rooms are deceptively simple and homey but five-star comfortable with soft beds, cloud-like pillows, writing desks and flat-screen TVs. Breakfast is included and attached is the French fusion Desbue restaurant.",https://www.lonelyplanet.com/india/goa/panaji-panjim/hotels/la-maison/a/poi-sle/1505938/356231
46,Bamboo Yoga Retreat,South Goa,,9637567730,www.bamboo-yoga-retreat.com,cottages per person €82-92,"This laid-back yoga retreat, exclusive to guests, has a wonderful open-sided shala facing the ocean at the southern end of Patnem Beach, and three more shalas among the village of beautifully designed timber and thatched huts. Yoga holiday rates include brunch, meditation and two daily yoga classes, but there are also training courses and ayurvedic treatments.",https://www.lonelyplanet.com/india/goa/patnem/hotels/bamboo-yoga-retreat/a/poi-sle/1506073/1302135
47,Wonderland Hostel,Anjuna,"69/6, Govekar Vaddo",8692993770,www.wonderlandhostel.com,"dm ₹500-600, d ₹2000-2500, without bathroom ₹1200-1500","Superchilled Wonderland, off the path behind Anjuna Beach near Lilliput, has a lineup of cabins comprising en suite dorms and a few private rooms (some with AC), as well as a couple of old-school basic bamboo tree houses and space for tents. Owner Sandeep welcomes travellers into his loungy chill-out area with a small kitchen and cafe. Free yoga classes daily at 9am.",https://www.lonelyplanet.com/india/goa/anjuna/hotels/wonderland-hostel/a/poi-sle/1611593/356225
48,Noi Varo,North Goa,Siolim-Chapora Rd,9011071911,www.shunyachi.com,"ste ₹10,300-13,500","This wonderful villa, ideal for families or groups looking to book the whole place, is uber exclusive. It’s a spacious, stunning refurbished Portuguese mansion with three double bedrooms and a variety of extra sleeping spaces. You can kick back amid antiques, hang out in its river-view tree house, consult with its gourmet chef and float in a cool swimming pool.",https://www.lonelyplanet.com/india/goa/siolim/hotels/noi-varo/a/poi-sle/1431323/1301993
49,Teso Waterfront,North Goa,Vaddy Siolim,0832-2270096,www.tesogoa.com,"luxury tents ₹18,200-23,300","This loungy upmarket party place has a cool location looking out on the lake-like mouth of the Chapora River, and is the new home of Thalassa restaurant. The safari Rajasthani tents are pricey but deluxe with air-con, fluffy beds, fridge, flat-screen TV, wardrobe and dresser. Muslin-wrapped cabanas make a great place to sip a cocktail overlooking the waterfront.",https://www.lonelyplanet.com/india/goa/siolim/hotels/teso-waterfront/a/poi-sle/1506452/1301993
50,Cassoi,South Goa,,7796456453,www.cassoibyciarans.com,huts & tents ₹3000-5000,"Woven into the palms on peaceful Galgibag Beach, this hut village has something for everyone with Rajasthani safari tents, round African-style huts, double-storey boat-shaped huts and air-con rooms in a house, all in an intimate garden. All the ecofriendly attention to detail is there and the restaurant serves great veg and nonveg food. Cassoi means 'turtle'.",https://www.lonelyplanet.com/india/goa/galgibag-talpona/hotels/cassoi/a/poi-sle/1612267/1329294
51,H2O Agonda,South Goa,Agonda Beach,9921836730,www.h2oagonda.com,d incl breakfast ₹5700-9300,"With its purple and mauve muslin curtains and Arabian nights ambience, H2O is among the most impressive of Agonda’s luxury cottage setups. From the hotel-style reception, walk through a leafy garden to the spacious cottages with air-con and enormous open-air bathrooms. The more expensive sea-facing cottages with king-size beds may be worth paying extra for.",https://www.lonelyplanet.com/india/goa/agonda/hotels/h2o-agonda/a/poi-sle/1506072/1302133
52,Nilaya Hermitage,Calangute & Baga,,0832-2269793,www.nilaya.com,"r & tent incl breakfast ₹17,300","The ultimate in Goan luxury, set 3km inland from the beach at Arpora, a stay here will see you signing the guestbook alongside Bollywood stars and other celebrity types. Eleven beautiful red-stone Moorish rooms undulate around a swimming pool, along with two luxury 'Arabian Nights' tents. The food is as dreamy as the surroundings, and the spa will spoil you.",https://www.lonelyplanet.com/india/goa/calangute-and-baga/hotels/nilaya-hermitage/a/poi-sle/1150095/1329280
53,Island House,Divar Island,No 45 Piedade,8322280605,www.islandhousegoa.com,r incl breakfast ₹5600,"Island House is a divine family-run homestay in a beautiful old Portuguese mansion. The villa and heritage rooms come with bathroom and colonial furnishings while outside is a pretty garden and pool, part of the rambling grounds. Home-cooked meals can be enjoyed inside or by the pool. It’s just west of the main village but there’s no sign – call ahead.",https://www.lonelyplanet.com/india/goa/divar-island/hotels/island-house/a/poi-sle/1430784/1329271
54,Vivanta by Taj Holiday Village,North Goa,Fort Aguada Rd,1800-111825,www.vivanta.tajhotels.com,"cottages ₹21,800-35,200","The Taj’s garden complex comprises 142 cottages and villas in a smart variation on a five-star theme, with all the luxuries you’d expect from this top-end chain. The palm-filled garden spills down to the beach, and its Banyan Tree restaurant is well regarded for good Thai food in beautiful al fresco surroundings.",https://www.lonelyplanet.com/india/goa/candolim-1329279/hotels/vivanta-by-taj-holiday-village/a/poi-sle/1024770/1329279
55,D’Mello’s Sea View Home,North Goa,"Monteiro’s Rd, Escrivao Vaddo",0832-2489395,www.dmellos.com,"d with/without AC ₹3500/2500, sea view ₹4750/4150","D’Mello’s has grown up from small beginnings, but is still family-run and occupies four buildings around a lovely garden just back from the beach. The front building has the premium sea-view rooms so check out a few, but all are clean and well maintained with balconies, four-poster beds and shuttered windows. Wi-fi is available in the central area.",https://www.lonelyplanet.com/india/goa/candolim-1329279/hotels/d-mello-s-sea-view-home/a/poi-sle/1150069/1329279
56,Taj Exotica Resort & Spa,South Goa,,0832-6683333,www.tajhotels.com,"d ₹34,500-63,500","Bollywood stars and sheikhs are known to stay at the Taj Exotica, one of Goa’s plushest and priciest resorts. Set in 23 hectares of tropical gardens 2km south of Benaulim, it has spas, restaurants and pools. Most travellers will be content to visit its swish restaurants, including the Goan cuisine of Miguel Arcanjo and the beachfront Lobster Village.",https://www.lonelyplanet.com/india/goa/benaulim/hotels/taj-exotica-resort-spa/a/poi-sle/1017984/1315142
57,Riverside,North Goa,Junas Waddo,9049503605,www.riversidemandrem.com,huts ₹800-1200,"At the southern end of Mandrem Beach, overlooking the creek, Riverside is an excellent, two-level open-sided restaurant with a collection of well-designed but affordable palm-thatch and timber huts at the back and side. These are some of the best-value beachfront huts in Mandrem and there's a kitesurfing school here and stand-up paddleboards for rent.",https://www.lonelyplanet.com/india/goa/mandrem/hotels/riverside/a/poi-sle/1552764/1301996
58,Sea Horse,Anjuna,,9764465078,www.vistapraiaanjuna.com,,"A lineup of timber cabins behind the beach restaurant of the same name, Sea Horse offers a good location and decent value. The huts are small and get a little hot – ask for the air-con remote control if it’s uncomfortably humid. Staff are friendly and accommodating. The same owners have a pricier beachfront setup nearby called Vista Praia Anjuna.",https://www.lonelyplanet.com/india/goa/anjuna/hotels/sea-horse/a/poi-sle/1506371/356225
59,Home,South Goa,,9923944676,www.homebeachresort.com,r ₹2000-3500,"Home is a lovely family-owned guesthouse-style resort with a popular beachfront restaurant serving awesome dessert – chocolate brownies, apple tarts and cheesecake. No beach huts here but eight neatly decorated, light-filled rooms behind the restaurant and some larger family rooms around the garden at the street entrance. Minimum two-night stay.",https://www.lonelyplanet.com/india/goa/patnem/hotels/home/a/poi-sle/1024774/1302135
60,Papaya’s,South Goa,,9923079447,www.papayasgoa.com,"huts ₹2000-3000, cottages with AC ₹4500","Solid huts constructed with natural materials head back into the palm grove from Papaya’s popular restaurant. These are easily some of the best cabins and rooms on Patnem Beach: each hut is lovingly built, with lots of wood, four-poster beds and floating muslin, while the one and two-bedroom air-con brick cottages are fitted out like apartments.",https://www.lonelyplanet.com/india/goa/patnem/hotels/papaya-s/a/poi-sle/1116944/1302135
61,Peace Garden,South Goa,,9168350727,www.peacegardengoa.com,huts ₹2100-4800,"Peace Garden is a well-constructed hut village on Talpona Beach with a focus on wellness and relaxation – there are drop-in yoga classes (₹500) daily, yoga holidays and massage and ayurvedic therapies. Accommodation ranges from garden cottages at the back to family cottages and the deluxe sea-facing huts, all with attached bathroom and fan.",https://www.lonelyplanet.com/india/goa/galgibag-talpona/hotels/peace-garden/a/poi-sle/1612268/1329294
62,Marbela Beach Resort,North Goa,782 Gawdewada,9158881185,www.marbelabeach.com,"tents & villas/ste ₹13,800/20,700","The luxury tents and ‘Spanish-style’ villas at this slick resort are pricey but fitted out like five-star hotel rooms. Even if you don’t stay here, the beachfront cabanas are a divine spot for a drink and the Euro fusion restaurant is destination dining. 'White parties' frequently draw a crowd. Naturally, there's a spa and yoga classes.",https://www.lonelyplanet.com/india/goa/morjim/hotels/marbela-beach-resort/a/poi-sle/1506326/1301994
63,Neelchand by Ciarans,South Goa,,7796783663,www.neelchand.com,cottages ₹4000,The Ciarans magic from Palolem has been transported to an absolute beachfront location on near-deserted Talpona Beach. There are just seven lovely timber cottages (five with air-con) in a sweet little garden strewn with hammocks and flowering plants. There's a beachfront restaurant and bar but this is a place for peace rather than partying.,https://www.lonelyplanet.com/india/goa/galgibag-talpona/hotels/neelchand-by-ciarans/a/poi-sle/1612266/1329294
64,Paradise,Anjuna,Anjuna-Mapusa Rd,9922541714,,"d ₹1000-1200, with AC ₹1500-2000","This friendly place is fronted by an old Portuguese home and offers neat, clean rooms with well-decorated options in the newer annexe. The better rooms have TVs, fridges and hammocks on the balcony. Friendly owner Janet and family also run the pharmacy, general store, restaurant, internet cafe, Connexions travel agency and money exchange.",https://www.lonelyplanet.com/india/goa/anjuna/hotels/paradise/a/poi-sle/1150102/356225
65,Palm Discoveries,South Goa,Khancola Beach,9820991637,www.palmdiscoveries.com,huts ₹1500,The six huts here are very simple and wonderfully isolated. It’s a steep walk down laterite steps through the jungle to get here and at the bottom you’re greeted with the secluded covelike Khancola Beach and the smiling staff at the small restaurant-bar. Even if you don’t stay it’s worth hiking down for a few hours on the beach.,https://www.lonelyplanet.com/india/goa/cola-beach/hotels/palm-discoveries/a/poi-sle/1508026/1340169
66,Dwarka Beach Resort,South Goa,Cola Beach,8551056490,www.dwarkagoa.com,"d huts incl meals ₹13,000","A beach hut for ₹13,000 – no way! The huts are certainly very nice and most are sea-facing, terracing down the hillside to the beach side of the lagoon. Boutique is the word here, with only 10 huts and lots of personal attention. And meals are included. But ₹13,000? Unsurprisingly, the restaurant and bar is exclusive to guests.",https://www.lonelyplanet.com/india/goa/cola-beach/hotels/dwarka-beach-resort/a/poi-sle/1612269/1340169
67,Beach Street,North Goa,Mandrem Beach,9403410679,,"huts ₹4300-6900, chalets ₹8600-11,800","The beachfront huts are adorable at Beach Street, where the adjacent building encloses an inviting pool. Well-designed huts range from simple with bathroom and verandah to two-storey palm-thatch family 'chalets' sleeping five. The Lazy Dog beachfront restaurant here has five-star aspirations with waiters dressed in cruise uniforms.",https://www.lonelyplanet.com/india/goa/mandrem/hotels/beach-street/a/poi-sle/1506451/1301996
68,Casa Susegad,South Goa,,0832-6483368,www.casasusegad.com,s/d ₹7500/9000,"With just five lovely, antique-filled rooms, this British-run place makes a wonderful upmarket retreat. An organic vegetable garden supplies the ingredients for delicious dinners, and a menagerie of parakeets, monkeys, cats and dogs inhabit the extensive gardens, complete with terrace swimming pool. It's about 1km from the church.",https://www.lonelyplanet.com/india/goa/loutolim/hotels/casa-susegad/a/poi-sle/1181904/1337575
69,Beach Box,Calangute & Baga,Baga River Rd. Baga,9607473627,http://boxhotels.in,d ₹4200-5400,About time someone in Goa thought of recycling old shipping containers. The rooms here are pretty cosy and they're a bit of a novelty in fully equipped half or full-size shipping containers with en suite and air-con. The in-ground pool is also a shipping container and the restaurant-bar is made up of various recycled materials.,https://www.lonelyplanet.com/india/goa/calangute-and-baga/hotels/beach-box/a/poi-sle/1613280/1329280
70,Casa Vagator,North Goa,,0832-2416738,www.casaboutiquehotels.com,"d incl breakfast ₹12,200-18,600","Down the steps past Nine Bar and opening out onto craggy Vagator Beach, this is a successfully rendered outfit in the deluxe Casa boutique mould, and one of Vagator’s most stylish accommodation options. Cosy rooms and lush gardens offer gorgeous views out across the wide blue horizon. Two pools and a spa complete the picture.",https://www.lonelyplanet.com/india/goa/vagator-chapora/hotels/casa-vagator/a/poi-sle/1116772/1329281
71,Island Pool Villa,Panaji & Central Goa,opposite St Batholomew's Church. Chorao,971505583613,,"villa incl breakfast from ₹11,700","This beautiful four-bedroom Portuguese villa on Chorao Island sleeps up to 12 people, so is a good deal for a family or group looking to get away from the beach and enjoy village life. Rooms are filled with antiques and four-poster beds but are air-conditioned and the shady garden with swimming pool is serene. Meals available.",https://www.lonelyplanet.com/india/goa/chorao-island-1337560/hotels/island-pool-villa/a/poi-sle/1610914/1337560
72,Sam’s Guesthouse,South Goa,,0832-2788753,,r ₹800,"Away from the fray, north of Colva’s main drag on the road running parallel to the beach, Sam’s is a big, cheerful place with friendly owners and spacious rooms that are a steal at this price. Rooms are around a pleasant garden courtyard and there’s a good restaurant and whacky 'cosy cave'. Wi-fi in the restaurant only.",https://www.lonelyplanet.com/india/goa/colva-and-benaulim/hotels/sam-s-guesthouse/a/poi-sle/1181919/1315141
73,Backpacker Panda,North Goa,"1116, Anna Vaddo",9172313995,www.backpackerpanda.com,dm from ₹500,"Down a winding lane and very close to the beach, this is Candolim's best bet for backpackers. Clean four- to eight-bed air-con dorms (some mixed, one female-only) have attached bathrooms and there's an open-sided cafe with loungy seating. Bike hire is available. Follow sign to Sonesta Inns and take the lane to the north.",https://www.lonelyplanet.com/india/goa/candolim-1329279/hotels/backpacker-panda/a/poi-sle/1610915/1329279
74,Palm Grove Cottages,South Goa,Vaswado,0832-2770059,www.palmgrovegoa.com,d incl breakfast ₹3800-4250,"Old-fashioned, secluded charm and Benaulim’s leafiest garden welcomes you at Palm Grove Cottages, a fine midrange choice. The quiet AC rooms, some with balcony, all have a nice feel but the best are the spacious deluxe rooms in a separate Portuguese-style building. The Palm Garden Restaurant here is exceptionally good.",https://www.lonelyplanet.com/india/goa/benaulim/hotels/palm-grove-cottages/a/poi-sle/1017989/1315142
75,Hotel Bougainvillea,Anjuna,Anjuna-Mapusa Rd,0832-273270,www.granpasinn.com,d/ste incl breakfast from ₹5700/7500,"An old-fashioned heritage hotel housed in a pretty, yellow 200-year-old ancestral mansion, ‘Granpa’s Inn’ offers charm and a touch of luxury with a lovely pool and well-decorated cottages. The grounds are lush, shady and make for a cool retreat, though some find it a little far from the beach for this price.",https://www.lonelyplanet.com/india/goa/anjuna/hotels/hotel-bougainvillea/a/poi-sle/1150104/356225
76,Mateus,Panaji,432 31st January Rd,7447488889,www.mateusgoa.com,d incl breakfast ₹4500-5000,"The nine boutique rooms are compact but delightful in this renovated 1879 Portuguese mansion. The whole place, with a striking canary-yellow facade, has been beautifully refurbished with a lounge and breakfast area, colonial-era furnishings and rear garden with a tiny pool. It's in the heart of the Old Quarter.",https://www.lonelyplanet.com/india/goa/panaji-panjim/hotels/mateus/a/poi-sle/1613169/356231
77,Johnny’s Hotel,Calangute & Baga,Khobra Vaddo. Calangute,0832-2277458,www.johnnyshotel.com,"s ₹800, d ₹1000-1500, with AC ₹1600-2000","The 12 simple rooms at this backpacker-popular place make for a sociable stay, with a downstairs restaurant-bar and regular yoga and reiki classes. A range of apartments and houses are available for longer stays. It’s down a lane lined with unremarkable midrange hotels and is just a short walk to the beach.",https://www.lonelyplanet.com/india/goa/calangute-and-baga/hotels/johnny-s-hotel/a/poi-sle/1150081/1329280
78,La La Land,Palolem,,7066129588,www.lalaland.in,cottages ₹4200-8700,"On Colomb Bay, La La Land takes Keralan-style cottages to another level with a range of quirky but stylish huts and A-frame chalets all set in a beautiful garden. The latest venture here is an ayurvedic spa and Yoga Land (www.yokoyoga.co.uk) shalas set back in the jungle, making this a true retreat.",https://www.lonelyplanet.com/india/goa/palolem-and-around/hotels/la-la-land/a/poi-sle/1558645/1001559
79,Riva Beach Resort,North Goa,,0832-2247612,www.rivaresorts.com,d ₹5000-9500,"This sprawling complex of hotel-style rooms and seasonal cottages tumbles down from the main road to the inlet, where bamboo bridges provide access to the beach. Spring mattresses, ocean-view balconies, a good restaurant and on-site yoga retreats. It's also a bit of a party spot – Sunday is the pool party.",https://www.lonelyplanet.com/india/goa/mandrem/hotels/riva-beach-resort/a/poi-sle/1506290/1301996
80,Camp San Francisco,Palolem,,9158057201,www.campsanfrancisco.com,huts & r ₹800-3500,"This hut village and associated guesthouse (Casa San Francisco) runs all the way from the beach to Palolem Beach Rd, offering a room or hut to suit most travellers. It's a good deal in mid-season as it has some of the cheaper huts along this stretch of beach. Naturally, there's a restaurant at the front.",https://www.lonelyplanet.com/india/goa/palolem-and-around/hotels/camp-san-francisco/a/poi-sle/1613988/1001559
81,Soul Vacation,South Goa,4th Ward,0832-2788147,www.soulvacation.in,"d incl breakfast ₹6300-8300, f villas from ₹10,400","Thirty sleek white rooms arranged around nice gardens and a neat pool are the trademarks of Soul Vacation, set 400m back from Colva Beach. This is central Colva’s most upmarket choice and, though pricey, there’s a nice air of exclusivity about it. There’s an ayurvedic spa, garden cafe and bar.",https://www.lonelyplanet.com/india/goa/colva-and-benaulim/hotels/soul-vacation/a/poi-sle/1024789/1315141
82,Shanu's Seaside Inn,North Goa,Escrivao Vaddo,9823016187,www.shanu.in,"d ₹1000, with AC ₹1500-3400","Shanu is one of several large guesthouses in this little grove just behind the dunes of Candolim Beach and it's a fine choice. The 18 rooms vary from basic but comfortable to deluxe rooms with sea views, air-con, king-sized beds and fridge. The owners also run the popular Pete's Shack on the beach.",https://www.lonelyplanet.com/india/goa/candolim-1329279/hotels/shanu-s-seaside-inn/a/poi-sle/1610919/1329279
83,Bhakti Kutir,Palolem,,9823627258,www.bhaktikutir.com,cottages ₹2800-4000,"Ensconced in a thick wooded grove in the Colomb Bay area south of Palolem, Bhakti’s rustic cottages are a little worn and you might find yourself sharing with local wildlife but this is still a popular eco and spiritual retreat with an ayurvedic massage centre and daily drop-in yoga classes.",https://www.lonelyplanet.com/india/goa/palolem-and-around/hotels/bhakti-kutir/a/poi-sle/1024777/1001559
84,Vivanta by Taj Fort Aguada,North Goa,,1800-111825,www.vivantabytaj.com,"d incl breakfast from ₹23,500, villa from ₹41,000","Dominating the headland above Sinquerim Beach, the Taj Group’s sprawling beach resort looks a little dated, but its service is still top-notch and the location impressive. Its Jiva Spa offers numerous soothing balms and palms, and the resort has a gym, pool, and three quality restaurants.",https://www.lonelyplanet.com/india/goa/candolim-1329279/hotels/vivanta-by-taj-fort-aguada/a/poi-sle/1431310/1329279
85,Anthy’s Guesthouse,South Goa,,0832-2771680,www.anthysguesthousegoa.com,d with/without AC ₹1900/1600,"One of a handful of places lining Sernabatim Beach, Anthy’s is a standout favourite with travellers for its good restaurant, book exchange and well-kept cottage-style garden rooms, which stretch back from the beach, surrounded by a garden. There are also a few comfortable wooden cabins.",https://www.lonelyplanet.com/india/goa/benaulim/hotels/anthy-s-guesthouse/a/poi-sle/1181928/1315142
86,La Ben,South Goa,Colva Beach Rd,0832-2788040,www.laben.net,r with/without AC ₹1800/1650,"Neat, clean and not entirely devoid of atmosphere, La Ben is a traveller hang-out in the middle of the action with decent, good-value rooms, and has been around for ages. There's a rooftop bar and, at street level, the very good Garden Restaurant.",https://www.lonelyplanet.com/india/goa/colva-and-benaulim/hotels/la-ben/a/poi-sle/1181920/1315141
87,Palm Trees,South Goa,Patnem Beach Rd,9673178731,www.thepalmtreesgoa.com,cottages ₹2000-2800,The 10 Keralan-style cottages here are a step up from most beach-hut accommodation – and a few steps back from the beach – with imported bamboo and palm-thatch materials from Kerala and thoughtful furniture and artworks. It's all set in a serene garden on the main road to the beach.,https://www.lonelyplanet.com/india/goa/patnem/hotels/palm-trees/a/poi-sle/1507026/1302135
88,Casa Anjuna,Anjuna,D’Mello Vaddo 66,0832-2274123,www.casaboutiquehotels.com,"d incl breakfast ₹7900-16,400","This heritage hotel is enclosed in lovely plant-filled gardens set around an inviting pool, managing to shield itself from the hype of central Anjuna. All rooms have antique furnishings and period touches; like many upmarket places it’s better value out of season, when rates halve.",https://www.lonelyplanet.com/india/goa/anjuna/hotels/casa-anjuna/a/poi-sle/1116765/356225
89,Vila Goesa,Calangute & Baga,,0832-2277535,www.vilagoesa.com,"d with/without AC from ₹4500/3000, cottage ₹4200-4700","Nicely situated between south Baga and north Calangute, and hidden in the palm thickets 200m back from the beach, this is a great place for lingering with a good book by the pool. Rooms are simple but pleasantly furnished; the higher the tariff, the closer you get to the beach.",https://www.lonelyplanet.com/india/goa/calangute-and-baga/hotels/vila-goesa/a/poi-sle/1181604/1329280
90,Red Door Hostel,Anjuna,,0832-2274423,,"dm with/without AC from ₹500/400, d with/without AC ₹2200/1900","Red Door is a welcoming backpacker place close to Anjuna’s central crossroads with clean four- and six-bed dorms plus a few private rooms. Facilities include lockers, free wi-fi, a garden, good communal areas – including a well-equipped kitchen – and a sociable cafe-bar.",https://www.lonelyplanet.com/india/goa/anjuna/hotels/red-door-hostel/a/poi-sle/1506648/356225
